PG.CellularComponent	PG.BiologicalProcess	PG.MolecularFunction	PG.UniprotIds	PG.Genes	PG.ProteinDescriptions	20220526_MK_LB_PB_E1200_15cm_noFAIMS_Fa2a_500ng.raw.PG.Label-Free Quant	20220526_MK_LB_PB_E1200_15cm_noFAIMS_Fa1a_500ng.raw.PG.Label-Free Quant	20220526_MK_LB_PB_E1200_15cm_noFAIMS_T4_500ng.raw.PG.Label-Free Quant	20220526_MK_LB_PB_E1200_15cm_noFAIMS_T3_500ng.raw.PG.Label-Free Quant	20220526_MK_LB_PB_E1200_15cm_noFAIMS_T2_500ng.raw.PG.Label-Free Quant	20220526_MK_LB_PB_E1200_15cm_noFAIMS_T1_500ng.raw.PG.Label-Free Quant	20220526_MK_LB_PB_E1200_15cm_noFAIMS_Fa2a_500ng.raw.PG.UniquePeptides	20220526_MK_LB_PB_E1200_15cm_noFAIMS_Fa1a_500ng.raw.PG.UniquePeptides	20220526_MK_LB_PB_E1200_15cm_noFAIMS_T4_500ng.raw.PG.UniquePeptides	20220526_MK_LB_PB_E1200_15cm_noFAIMS_T3_500ng.raw.PG.UniquePeptides	20220526_MK_LB_PB_E1200_15cm_noFAIMS_T2_500ng.raw.PG.UniquePeptides	20220526_MK_LB_PB_E1200_15cm_noFAIMS_T1_500ng.raw.PG.UniquePeptides
;cytoplasm	;protein folding	;ATP binding,unfolded protein binding	A0A5G2QHR6;I3L9J4	CCT6A	Uncharacterized protein	NaN	NaN	6485892	6279881	6600108	4574378	NaN	NaN	8	8	8	8
;	;	;	A0A287B0Q6;A0A287BMW9	FGD4	Dynamin-1-like protein	NaN	NaN	1.407591E+08	9.59327E+07	1.206251E+08	1.600187E+08	NaN	NaN	24	24	24	24
			A0A287ACP9	EHHADH	Enoyl-CoA hydratase	NaN	NaN	2266506	1872720	731082.4	1481730	NaN	NaN	4	4	4	4
;;nucleus,cytosol,plasma membrane,cell-cell junction,midbody	;;negative regulation of canonical Wnt signaling pathway,cell-cell adhesion	;;receptor binding,cadherin binding	A0A287BBS6;A0A287BEQ9;F1SJY6	CTNND1	Catenin delta 1	NaN	NaN	511748.6	4100335	944310.7	1895379	NaN	NaN	5	5	5	5
;;;;;integral component of membrane	;;;;;	;;;;;	A0A287A4N8;A0A287BA80;A0A287BRR8;A0A5G2QZI1;A0A5G2R2P5;F1STC7	CNNM3	Cyclin and CBS domain divalent metal cation transport mediator 3	NaN	NaN	2011012	NaN	NaN	NaN	NaN	NaN	1	NaN	NaN	NaN
;;	;;	;;	A0A287A8H1;A0A287AYH3;A0A287B231	UBQLN1	Ubiquilin 1	NaN	NaN	8999421	2457268	1.166052E+07	3.47301E+07	NaN	NaN	5	5	5	5
cornified envelope,nucleoplasm,endosome,cytosol,actin filament,cell-cell adherens junction,apical plasma membrane,lateral plasma membrane,extrinsic component of external side of plasma membrane,motile cilium,sarcolemma,extracellular exosome;	monocyte chemotaxis,regulation of leukocyte migration,phagocytosis,inflammatory response,G-protein coupled receptor signaling pathway, coupled to cyclic nucleotide second messenger,regulation of cell shape,myoblast migration involved in skeletal muscle regeneration,peptide cross-linking,keratinocyte differentiation,positive regulation of vesicle fusion,actin cytoskeleton reorganization,regulation of interleukin-1 production,positive regulation of interleukin-2 production,positive regulation of neutrophil apoptotic process,cellular response to vascular endothelial growth factor stimulus,positive regulation of T cell proliferation,negative regulation of catalytic activity,positive regulation of T-helper 1 cell differentiation,negative regulation of T-helper 2 cell differentiation,negative regulation of exocytosis,alpha-beta T cell differentiation,regulation of hormone secretion,arachidonic acid secretion,regulation of inflammatory response,cellular response to glucocorticoid stimulus,granulocyte chemotaxis,positive regulation of cell migration involved in sprouting angiogenesis,positive regulation of wound healing,neutrophil clearance,cell-cell adhesion,positive regulation of G1/S transition of mitotic cell cycle,negative regulation of interleukin-8 secretion;	structural molecule activity,calcium ion binding,calcium-dependent phospholipid binding,phospholipase A2 inhibitor activity,protein binding, bridging,calcium-dependent protein binding,cadherin binding involved in cell-cell adhesion;	F1SJB5;K7GLE1	ANXA1	Annexin	NaN	NaN	1.074676E+07	1.932666E+07	1.080241E+07	1.847476E+07	NaN	NaN	6	6	6	6
;mitochondrial inner membrane,mitochondrial fatty acid beta-oxidation multienzyme complex,mitochondrial nucleoid	;fatty acid beta-oxidation,response to insulin	;enoyl-CoA hydratase activity,long-chain-3-hydroxyacyl-CoA dehydrogenase activity	A0A5G2RBW4;Q29554	HADHA	Enoyl-CoA hydratase;Trifunctional enzyme subunit alpha, mitochondrial	NaN	NaN	3.058994E+07	1.909504E+07	3.023628E+07	6.770874E+07	NaN	NaN	21	21	21	21
;;;	;;;	;;;	A0A287A0J1;A0A287AGU7;A0A287AHL4;A0A287AZ37	LOC100624785	Tubulin beta chain	NaN	NaN	2.71162E+08	2.795197E+07	6410990	1.913806E+07	NaN	NaN	3	3	3	3
;	;transcription, DNA-templated,DNA biosynthetic process	;DNA binding,DNA-directed DNA polymerase activity	A0A286ZYY8;A0A287BBE4	MYBBP1A	MYB binding protein 1a	NaN	NaN	746808.1	972561.3	NaN	NaN	NaN	NaN	2	2	NaN	NaN
		ligase activity	A0A287B773	MCCC2	3-methylcrotonyl-CoA carboxylase 2	NaN	NaN	1799879	166522	1563439	232852	NaN	NaN	3	3	3	3
cytoplasm;;;;;	fructose 6-phosphate metabolic process,glycolytic process through fructose-6-phosphate;;;;;	6-phosphofructokinase activity,ATP binding,metal ion binding;;;;;	A0A286ZIJ9;A0A286ZKJ2;A0A286ZQ47;A0A287B7N8;A0A287B8N1;A0A287BCP5	PFKM	ATP-dependent 6-phosphofructokinase	NaN	NaN	1.329211E+07	1.960989E+07	2.01649E+07	1.910798E+07	NaN	NaN	13	13	13	13
;;;;	membrane tubulation;;;;	;;;;	A0A287AQ12;A0A287AR93;A0A287ATC5;A0A287BQ85;F1SIC0	PACSIN3	Protein kinase C and casein kinase substrate in neurons 3	NaN	NaN	3.629996E+07	2.568426E+07	2.513271E+07	3.220543E+07	NaN	NaN	5	5	5	5
;	;	;	A0A5G2Q990;F1RW98	RSU1	Ras suppressor protein 1	NaN	NaN	2.221038E+07	2.295997E+07	1.213365E+07	1.428003E+07	NaN	NaN	5	5	5	5
;extracellular space,cell;;;	;copper ion transport,cellular iron ion homeostasis,oxidation-reduction process;;;	;ferroxidase activity,copper ion binding,chaperone binding;;;	A0A5G2QW05;F1SKB1;K7GKN3;K7GMZ8;K7GQB8	CP	Uncharacterized protein	NaN	NaN	1384683	4944955	3.23106E+07	7118344	NaN	NaN	9	9	9	9
;	protein dephosphorylation;	protein serine/threonine phosphatase activity,metal ion binding;	A0A287A5F9;F1RY43	PDP1	Pyruvate dehyrogenase phosphatase catalytic subunit 1	NaN	NaN	2.928158E+07	2.372114E+07	1.277897E+07	3.06289E+07	NaN	NaN	10	10	10	10
;;;	;actin filament polymerization;;	;;;	A0A287AUL3;A0A287BKR0;A0A5G2QWJ7;A0A5G2QYI6	CTTN	Cortactin	NaN	NaN	1.359427E+07	4.073308E+07	1.028396E+07	2.13017E+07	NaN	NaN	8	8	8	8
			A0A287BK35	COL6A5	Collagen type VI alpha 5 chain	NaN	NaN	623304.6	NaN	1.011698E+07	5078300	NaN	NaN	12	NaN	12	12
;;;;;nucleoplasm,cytosol	;;;;;in utero embryonic development,regulation of transcription, DNA-templated,peptidyl-arginine methylation, to asymmetrical-dimethyl arginine,histone H4-R3 methylation	;;;;;histone-arginine N-methyltransferase activity,protein-arginine omega-N asymmetric methyltransferase activity	A0A286ZN59;A0A286ZP03;A0A287B7C9;A0A287BTE0;A0A5G2QA32;F1RHU6	PRMT1	Protein arginine methyltransferase 1;Protein arginine methyltransferase 1;Protein arginine methyltransferase 1;Protein arginine methyltransferase 1;Protein arginine methyltransferase 1;Protein arginine N-methyltransferase 1 isoform 1	NaN	NaN	237599.5	2314624	NaN	493990.3	NaN	NaN	2	2	NaN	2
;microtubule organizing center,cytosol,kinesin complex,microtubule,ciliary rootlet,neuron projection,phagocytic vesicle	;microtubule-based movement,cytoplasm organization,axon guidance,protein localization,cytoskeleton-dependent intracellular transport,positive regulation of synaptic transmission, GABAergic,stress granule disassembly,regulation of membrane potential,positive regulation of potassium ion transport,centrosome localization,cellular response to interferon-gamma,plus-end-directed vesicle transport along microtubule,positive regulation of protein localization to plasma membrane	;ATP binding,microtubule binding,ATP-dependent microtubule motor activity, plus-end-directed,identical protein binding,cadherin binding	A0A287A1V7;F1RWC5	KIF5B	Kinesin-like protein	NaN	NaN	1.771649E+07	3.782314E+07	5367674	7401097	NaN	NaN	14	14	14	14
			A0A5G2QFS9	TSFM	Elongation factor Ts, mitochondrial	NaN	NaN	2.499745E+07	6180471	2.501755E+07	3682806	NaN	NaN	4	4	4	4
;mitochondrion,pyruvate dehydrogenase complex	;acetyl-CoA biosynthetic process from pyruvate	;transferase activity, transferring acyl groups,pyruvate dehydrogenase (NAD+) activity	A0A5G2QSG9;F1SGT3	PDHX	Dihydrolipoamide acetyltransferase component of pyruvate dehydrogenase complex	NaN	NaN	8159891	2587936	2505379	2.55607E+07	NaN	NaN	2	2	2	2
;Golgi apparatus,cytosol,zonula adherens,intercalated disc,actin cytoskeleton,catenin complex,flotillin complex,lamellipodium	;actin filament organization,establishment or maintenance of cell polarity,negative regulation of neuroblast proliferation,cellular protein localization,apical junction assembly,positive regulation of smoothened signaling pathway,cellular response to indole-3-methanol,epithelial cell-cell adhesion,negative regulation of cell motility,negative regulation of integrin-mediated signaling pathway,negative regulation of extrinsic apoptotic signaling pathway in absence of ligand,positive regulation of extrinsic apoptotic signaling pathway in absence of ligand	;structural molecule activity,beta-catenin binding,vinculin binding,identical protein binding,gamma-catenin binding,cadherin binding,protein heterodimerization activity,actin filament binding	A0A5G2R7Z4;F1RGJ2	CTNNA1	Catenin alpha 1	NaN	NaN	1.393276E+07	1.864357E+07	4777625	1.058353E+07	NaN	NaN	13	13	13	13
;	;	;RNA binding	A0A5G2QQ58;I3LKV0	SLIRP	SRA stem-loop interacting RNA binding protein	NaN	NaN	861189.3	NaN	74534.83	NaN	NaN	NaN	1	NaN	1	NaN
	regulation of myotube differentiation,regulation of RNA splicing	mRNA binding	A5GFN8	RBM38	RNA binding motif protein 38	NaN	NaN	2.443019E+07	1.232328E+07	1.742315E+07	6.238895E+07	NaN	NaN	3	3	3	3
;cytoplasm,extracellular matrix	;	;	A0A287BEH3;F1SDV5	EMILIN3	Elastin microfibril interfacer 3	NaN	NaN	6550499	1120965	8344585	9002548	NaN	NaN	18	18	18	18
	pseudouridine synthesis,tRNA processing	RNA binding,pseudouridine synthase activity	A0A287B3S4	PUS1	Pseudouridine synthase 1	NaN	NaN	491149.7	1178599	805940.1	NaN	NaN	NaN	2	2	2	NaN
;nucleus,cytosol,actin cytoskeleton,nuclear speck,Z disc,cell junction	;positive regulation of actin filament bundle assembly	;actin binding	A0A5G2R2B8;F1SU55	SYNPO2L	Synaptopodin 2 like	NaN	NaN	2512973	3.411098E+07	1.003117E+07	1.591922E+07	NaN	NaN	13	13	13	13
			A0A287BPF4	COL6A3	Collagen type VI alpha 3 chain	NaN	NaN	3322471	1754718	NaN	1407306	NaN	NaN	3	3	NaN	3
;;;cytoplasm,cytosol,plasma membrane	;;;proteolysis,regulation of catalytic activity,self proteolysis	;;;calcium-dependent cysteine-type endopeptidase activity,calcium ion binding	A0A5G2QYC6;A0A5S6GBZ7;A0A5S6H4P7;P35750	CAPN1	Calpain-1 catalytic subunit;Calcium-activated neutral proteinase 1;Calcium-activated neutral proteinase 1;Calpain-1 catalytic subunit	NaN	NaN	589517.5	NaN	NaN	NaN	NaN	NaN	1	NaN	NaN	NaN
ubiquitin ligase complex,nucleus,cytoplasm	protein polyubiquitination,ER-associated ubiquitin-dependent protein catabolic process	ubiquitin-ubiquitin ligase activity	F1SAK7	ATP5MG	ATP synthase subunit	NaN	NaN	120827.8	NaN	NaN	625116.2	NaN	NaN	1	NaN	NaN	1
;;;;;;	;;;;;;	;;;;;;	A0A287AJF0;A0A287AKV0;A0A287B0H0;A0A287BSM0;A0A5G2QUA2;A0A5G2QUP2;F1RVD4	SEC31A	SEC31 homolog A, COPII coat complex component;SEC31 homolog A, COPII coat complex component;SEC31 homolog A, COPII coat complex component;SEC31 homolog A, COPII coat complex component;SEC31 homolog A, COPII coat complex component;SEC31 homolog A, COPII coat complex component;SEC31 homolog A, COPII coat complex component	NaN	NaN	1.535153E+07	1.499274E+07	9006139	1.486379E+07	NaN	NaN	9	9	9	9
			A0A287ADQ2	DTNA	Dystrobrevin	NaN	NaN	2852953	1351410	3043352	3737187	NaN	NaN	8	8	8	8
mitochondrial matrix	long-chain fatty acid catabolic process,oxidation-reduction process	long-chain-acyl-CoA dehydrogenase activity,flavin adenine dinucleotide binding	P79274	ACADL	Long-chain specific acyl-CoA dehydrogenase, mitochondrial	NaN	NaN	9421284	2606704	1.057366E+07	1046800	NaN	NaN	2	2	2	2
tRNA-splicing ligase complex	protein methylation,positive regulation of cell proliferation,positive regulation of gene expression,lysosome localization,positive regulation of ruffle assembly	protein methyltransferase activity	F1S408	FAM98A	Family with sequence similarity 98 member A	NaN	NaN	8108429	2368104	1592419	1.857358E+07	NaN	NaN	4	4	4	4
;	protein folding;	ATP binding,unfolded protein binding;	A0A287ADJ2;F1RGJ3	HSPA9	75 kDa glucose-regulated protein	NaN	NaN	5.877515E+07	5.340916E+07	2.374684E+07	7.074208E+07	NaN	NaN	20	20	20	20
	metabolic process	catalytic activity	A0A287AA21	ECHS1	Enoyl-CoA hydratase, mitochondrial	NaN	NaN	2189977	5481073	4391811	7409403	NaN	NaN	6	6	6	6
;extracellular space	;negative regulation of endopeptidase activity,negative regulation of apoptotic process	;serine-type endopeptidase inhibitor activity	A0A287AND4;F1SMW7	SERPINB2	Serpin family B member 2;Plasminogen activator inhibitor 2	NaN	NaN	5.660097E+07	1.333891E+08	2.589144E+07	5.147761E+07	NaN	NaN	13	13	13	13
;nucleus,cytosol,cell surface,cytoplasmic vesicle,synapse;	;ubiquitin-dependent protein catabolic process,chemical synaptic transmission,negative regulation of endopeptidase activity,protein deubiquitination,regulation of chemotaxis,negative regulation of ER-associated ubiquitin-dependent protein catabolic process;	;thiol-dependent ubiquitin-specific protease activity,endopeptidase inhibitor activity,proteasome binding;	A0A5G2R2E3;I3LIN5;I3LRU5	USP14	Ubiquitin carboxyl-terminal hydrolase	NaN	NaN	2229465	2213597	512015.3	1808449	NaN	NaN	4	4	4	4
			K9IVI1	OGDH	Oxoglutarate dehydrogenase (succinyl-transferring)	NaN	NaN	1.989963E+07	2.325833E+07	4.937797E+07	5.510001E+07	NaN	NaN	27	27	27	27
;	protein folding;	ATP binding,unfolded protein binding;	A0A287ADU8;F1SJL5	CLPX	ATP-dependent Clp protease ATP-binding subunit clpX-like, mitochondrial;ATP-dependent Clp protease ATP-binding subunit clpX-like, mitochondrial isoform X2	NaN	NaN	4607977	NaN	4642139	1175744	NaN	NaN	2	NaN	2	2
;plasma membrane,anchored component of membrane,very-low-density lipoprotein particle,chylomicron;;;;extracellular space,plasma membrane,anchored component of membrane,very-low-density lipoprotein particle,chylomicron	;lipid catabolic process;;;;response to glucose,triglyceride biosynthetic process,triglyceride catabolic process	;lipoprotein lipase activity,heparin binding;;;;lipoprotein lipase activity,heparin binding	A0A287ATV6;A0A287BML3;A0A5G2QQY2;A0A5G2R179;A0A5G2R4D8;P49923	LPL	Lipoprotein lipase	NaN	NaN	1.721162E+07	2.234861E+07	1.372871E+07	3422597	NaN	NaN	7	7	7	7
extracellular region,endoplasmic reticulum	extracellular negative regulation of signal transduction	heparin binding,receptor antagonist activity,low-density lipoprotein particle receptor binding	F1S8M9	LRPAP1	Alpha-2-macroglobulin receptor-associated protein	NaN	NaN	2.521798E+07	1.304508E+07	9525912	7374391	NaN	NaN	12	12	12	12
;nucleus,mitochondrial intermembrane space,cytosol	;activation of cysteine-type endopeptidase activity involved in apoptotic process,neuron apoptotic process,oxidation-reduction process,intrinsic apoptotic signaling pathway in response to endoplasmic reticulum stress,regulation of apoptotic DNA fragmentation	;DNA binding,NAD(P)H oxidase activity,protein dimerization activity,FAD binding	A0A5G2R2C9;F1RTH3	AIFM1	Apoptosis inducing factor mitochondria associated 1	NaN	NaN	1385324	1414446	2513782	4230702	NaN	NaN	7	7	7	7
mitochondrion,mitochondrial proton-transporting ATP synthase complex,cell surface	negative regulation of endothelial cell proliferation,heme biosynthetic process,erythrocyte differentiation,negative regulation of ATPase activity,protein homooligomerization,protein homotetramerization,negative regulation of hydrolase activity,mitochondrial depolarization,reactive oxygen species metabolic process,positive regulation of mitochondrial outer membrane permeabilization involved in apoptotic signaling pathway,positive regulation of proteolysis involved in cellular protein catabolic process,regulation of protein targeting to mitochondrion,regulation of ATP metabolic process,positive regulation of mitophagy in response to mitochondrial depolarization,folic acid-containing compound biosynthetic process,tetrahydrofolate interconversion	calmodulin binding,ATPase inhibitor activity,protein homodimerization activity,angiostatin binding,ATPase binding,5-formyltetrahydrofolate cyclo-ligase activity	Q29307	ATP5IF1	ATPase inhibitor, mitochondrial	NaN	NaN	1.222787E+07	5809445	5994411	1941534	NaN	NaN	4	4	4	4
;;ubiquitin ligase complex,Prp19 complex,nucleus,late endosome,cytosol,intracellular ribonucleoprotein complex,myelin sheath,extracellular exosome	;;regulation of protein stability,protein refolding,positive regulation by host of viral genome replication,negative regulation of transcription, DNA-templated,ATP metabolic process,positive regulation of mRNA splicing, via spliceosome,chaperone mediated protein folding requiring cofactor,regulation of cell cycle,late endosomal microautophagy,protein targeting to lysosome involved in chaperone-mediated autophagy,clathrin coat disassembly,negative regulation of fibril organization	;;G-protein coupled receptor binding,phosphatidylserine binding,ATP binding,heat shock protein binding,ubiquitin protein ligase binding,ATPase activity, coupled,cadherin binding,unfolded protein binding,C3HC4-type RING finger domain binding	A0A286ZWK2;F1S9Q1;F1S9Q3	HSPA8	Uncharacterized protein	NaN	NaN	7.168186E+07	4.055171E+07	5.254002E+07	6.183752E+07	NaN	NaN	18	18	18	18
;mitochondrion,mitochondrial inner membrane,mitochondrial matrix,plasma membrane,myelin sheath	;2-oxoglutarate metabolic process,oxaloacetate metabolic process,aspartate metabolic process,aspartate biosynthetic process,aspartate catabolic process,glutamate metabolic process,fatty acid transport,glutamate catabolic process to aspartate,glutamate catabolic process to 2-oxoglutarate,response to ethanol,L-kynurenine metabolic process	;L-aspartate:2-oxoglutarate aminotransferase activity,kynurenine-oxoglutarate transaminase activity,pyridoxal phosphate binding	A0A287BH33;P00506	GOT2	Aspartate aminotransferase;Aspartate aminotransferase, mitochondrial	NaN	NaN	1.831856E+08	1.22031E+08	9.250606E+07	1.439791E+08	NaN	NaN	14	14	14	14
			A0A287AZA3	COPS3	COP9 signalosome subunit 3	NaN	NaN	327004.9	328076	NaN	NaN	NaN	NaN	1	1	NaN	NaN
;microtubule	;microtubule cytoskeleton organization,nervous system development	;microtubule binding	A0A286ZJQ4;A0A287BL20	MAP1B	Microtubule associated protein 1B	NaN	NaN	8309390	1.079898E+07	4660528	1.247341E+07	NaN	NaN	13	13	13	13
;	;	calcium ion binding;	A0A286ZWQ1;F1S405	LTBP1	Latent transforming growth factor beta binding protein 1	NaN	NaN	9499858	6802692	2.535634E+07	5.728177E+07	NaN	NaN	9	9	9	9
;	;	;	A0A5G2QL63;A0A5G2RG25	PXN	Paxillin	NaN	NaN	950958.9	338606.2	675870.4	458280.3	NaN	NaN	4	4	4	4
			A0A287BKP9	VWA1	von Willebrand factor A domain containing 1	NaN	NaN	2.512231E+07	2662184	4240866	2.701996E+07	NaN	NaN	7	7	7	7
			A0A286ZLT8	LDB3	PDZ domain-containing protein	NaN	NaN	1.081681E+08	3.130723E+08	1.838401E+08	1.720021E+08	NaN	NaN	4	4	4	4
mitochondrion	in utero embryonic development,apoptotic DNA fragmentation,response to tumor necrosis factor,positive regulation of apoptotic process,response to antibiotic	nucleic acid binding,hydrolase activity,metal ion binding	F1RR64	ENDOG	Endonuclease	NaN	NaN	1.184711E+08	4.718214E+07	2.134788E+07	9.055944E+07	NaN	NaN	4	4	4	4
;;cytoplasm,actin cytoskeleton,nuclear matrix,lamellipodium,lamellipodium membrane,ruffle membrane	;;cytoskeleton organization,regulation of cell morphogenesis,actin filament depolymerization	;;actin filament binding	A0A286ZVE7;K7GK75;P10668	CFL1	Cofilin, non-muscle isoform;Cofilin, non-muscle isoform;Cofilin-1	NaN	NaN	4093932	1.610024E+07	2118578	2378365	NaN	NaN	6	6	6	6
;;;	;;;	;;;	A0A5G2QHC3;A0A5G2QNI3;A0A5G2R986;I3LPY1	TNS1	Uncharacterized protein	NaN	NaN	1.018196E+08	6.241192E+07	5.902952E+07	8.627848E+07	NaN	NaN	32	32	32	32
			F6Q936	CCT2	CCT-beta	NaN	NaN	8501647	4745831	2640581	5581466	NaN	NaN	7	7	7	7
extracellular space,integral component of membrane;	G-protein coupled receptor signaling pathway,negative regulation of cell proliferation,negative regulation of cell development,neural crest cell differentiation,negative regulation of cell growth,non-canonical Wnt signaling pathway,positive regulation of apoptotic process,positive regulation of fat cell differentiation,convergent extension involved in organogenesis,canonical Wnt signaling pathway,negative regulation of cartilage development,somite development,negative regulation of hepatocyte differentiation,negative regulation of canonical Wnt signaling pathway,cochlea morphogenesis;	G-protein coupled receptor activity,Wnt-protein binding,Wnt-activated receptor activity;	F1RYL4;S5Y9V4	FRZB	Frizzled-related protein 1	NaN	NaN	1.373853E+07	7059295	3.122202E+07	2.628857E+07	NaN	NaN	3	3	3	3
			A0A5G2R3R1	DR1	Down-regulator of transcription 1	NaN	NaN	6837028	4009734	8647491	4213050	NaN	NaN	4	4	4	4
;nucleus,nucleoplasm,cytosol,plasma membrane,intermediate filament cytoskeleton	;autophagosome assembly,Golgi organization,nuclear envelope reassembly,proteasome-mediated ubiquitin-dependent protein catabolic process,regulation of phosphoprotein phosphatase activity,membrane fusion	;protein phosphatase regulator activity,ubiquitin binding	A0A5G2R8G1;F1S880	NSFL1C	NSFL1 cofactor p47	NaN	NaN	8.668291E+07	1.725908E+07	4.077421E+07	3.673691E+07	NaN	NaN	16	16	16	16
;zona pellucida receptor complex,nucleolus,centrosome,chaperonin-containing T-complex,microtubule,myelin sheath,cell body	;'de novo' protein folding,binding of sperm to zona pellucida,response to virus,positive regulation of telomere maintenance via telomerase,protein stabilization,chaperone-mediated protein folding,toxin transport,positive regulation of establishment of protein localization to telomere,positive regulation of protein localization to Cajal body,positive regulation of telomerase RNA localization to Cajal body	;mRNA 3'-UTR binding,ATP binding,G-protein beta-subunit binding,protein binding involved in protein folding,mRNA 5'-UTR binding,beta-tubulin binding,unfolded protein binding	A0A5G2QVV0;I3LR32	CCT5	CCT-epsilon	NaN	NaN	5453454	5843973	4467508	3638000	NaN	NaN	7	7	7	7
;;;U6atac snRNP,Cajal body,U4/U6 snRNP;	;;;spliceosomal tri-snRNP complex assembly,cell morphogenesis,nucleosome assembly,regulation of gene expression,homeostasis of number of cells,hematopoietic stem cell proliferation,positive regulation of histone deubiquitination;	;;;U6 snRNA binding,U4 snRNA binding,U6atac snRNA binding,histone binding,ubiquitin-specific protease binding;	A0A286ZX14;A0A287AKY8;A0A5G2QI51;F1RGA7;I3LQ20	SART3	Spliceosome associated factor 3, U4/U6 recycling protein;Spliceosome associated factor 3, U4/U6 recycling protein;Spliceosome associated factor 3, U4/U6 recycling protein;Spliceosome associated factor 3, U4/U6 recycling protein;Spliceosome associated factor 3, U4/U6 recycling protein	NaN	NaN	916977.3	243893.6	NaN	NaN	NaN	NaN	1	1	NaN	NaN
;cytoplasm,centrosome	;protein refolding,positive regulation of microtubule nucleation,regulation of mitotic spindle assembly	ATP binding;ATP binding	A0A287BQU9;Q6S4N2	;HSPA1B	Uncharacterized protein;Heat shock 70 kDa protein 1B	NaN	NaN	5.682635E+07	4.484058E+07	6.774836E+07	4.075545E+07	NaN	NaN	18	18	18	18
;;;;;	;;;;;	;;;RNA binding;;	A0A286ZQN9;A0A287A105;A0A287BCL0;A0A287BL05;F2Z5H9;I3L816	HNRNPH1	Heterogeneous nuclear ribonucleoprotein H1	NaN	NaN	5.902058E+07	2.161653E+07	6.952838E+07	3.577808E+07	NaN	NaN	8	8	8	8
			F1RMJ4	IQGAP1	Uncharacterized protein	NaN	NaN	1.422074E+07	5890311	1702423	1.389181E+07	NaN	NaN	15	15	15	15
;zona pellucida receptor complex,mitochondrion,chaperonin-containing T-complex,microtubule,cell body	;protein folding,binding of sperm to zona pellucida,positive regulation of telomere maintenance via telomerase,protein stabilization,toxin transport,positive regulation of establishment of protein localization to telomere,positive regulation of protein localization to Cajal body,positive regulation of telomerase RNA localization to Cajal body	;ATP binding,identical protein binding,unfolded protein binding	A0A5G2RAV7;D0G0C9	CCT7	T-complex protein 1 subunit eta	NaN	NaN	5669448	2841879	596254.6	3745415	NaN	NaN	4	4	4	4
			A0A286ZVQ0	ACOT4	Uncharacterized protein	NaN	NaN	4.161355E+07	1.789927E+07	2.97012E+07	4.089738E+07	NaN	NaN	11	11	11	11
;;	;;regulation of transcription, DNA-templated	;;DNA binding	A0A287B2T9;A0A287B9X6;A0A287BM79	CSDE1	Cold shock domain containing E1	NaN	NaN	630309.3	1988800	1475128	3199422	NaN	NaN	8	8	8	8
;nucleolus,macromolecular complex	;negative regulation of protein kinase activity,cellular response to drug,peptidyl-threonine dephosphorylation,positive regulation of stress fiber assembly	;protein serine/threonine phosphatase activity,metal ion binding	A0A5G2R9E8;I3LNY3	PPM1E	Protein phosphatase, Mg2+/Mn2+ dependent 1E;Protein phosphatase 1E	NaN	NaN	2.021069E+07	1.425287E+08	4.251172E+07	2.195335E+07	NaN	NaN	7	7	7	7
;;;clathrin-coated vesicle;;;;	;;;endocytosis,clathrin coat assembly;;;;	;;;1-phosphatidylinositol binding,clathrin binding;;;;	A0A286ZU42;A0A286ZVR5;A0A287B808;A0A287BDW0;A0A5G2RAI6;A0A5G2RBW5;F1STS9;F8T0U2	PICALM	Phosphatidylinositol binding clathrin assembly protein;Phosphatidylinositol binding clathrin assembly protein;Phosphatidylinositol binding clathrin assembly protein;Phosphatidylinositol binding clathrin assembly protein;Phosphatidylinositol binding clathrin assembly protein;Phosphatidylinositol binding clathrin assembly protein;Phosphatidylinositol binding clathrin assembly protein;Phosphatidylinositol-binding clathrin assembly protein	NaN	NaN	4.383934E+07	1.379127E+07	1.500172E+07	1.296108E+07	NaN	NaN	8	8	8	8
			A0A287A3T1	TOLLIP	Toll interacting protein	NaN	NaN	5.294164E+07	3.085937E+07	3.742666E+07	2.0054E+07	NaN	NaN	4	4	4	4
