PG.CellularComponent	PG.BiologicalProcess	PG.MolecularFunction	PG.UniprotIds	PG.Genes	PG.ProteinDescriptions	20220526_MK_LB_PB_E1200_15cm_noFAIMS_Fa2a_500ng.raw.PG.Label-Free Quant	20220526_MK_LB_PB_E1200_15cm_noFAIMS_Fa1a_500ng.raw.PG.Label-Free Quant	20220526_MK_LB_PB_E1200_15cm_noFAIMS_T4_500ng.raw.PG.Label-Free Quant	20220526_MK_LB_PB_E1200_15cm_noFAIMS_T3_500ng.raw.PG.Label-Free Quant	20220526_MK_LB_PB_E1200_15cm_noFAIMS_T2_500ng.raw.PG.Label-Free Quant	20220526_MK_LB_PB_E1200_15cm_noFAIMS_T1_500ng.raw.PG.Label-Free Quant	20220526_MK_LB_PB_E1200_15cm_noFAIMS_Fa2a_500ng.raw.PG.UniquePeptides	20220526_MK_LB_PB_E1200_15cm_noFAIMS_Fa1a_500ng.raw.PG.UniquePeptides	20220526_MK_LB_PB_E1200_15cm_noFAIMS_T4_500ng.raw.PG.UniquePeptides	20220526_MK_LB_PB_E1200_15cm_noFAIMS_T3_500ng.raw.PG.UniquePeptides	20220526_MK_LB_PB_E1200_15cm_noFAIMS_T2_500ng.raw.PG.UniquePeptides	20220526_MK_LB_PB_E1200_15cm_noFAIMS_T1_500ng.raw.PG.UniquePeptides
cytosol,caveola,microtubule cytoskeleton,extrinsic component of membrane,intercellular bridge,perinuclear region of cytoplasm,recycling endosome membrane	endocytosis,cortical actin cytoskeleton organization,endocytic recycling,protein localization to plasma membrane,membrane tubulation,positive regulation of myoblast fusion,positive regulation of endocytic recycling	calcium ion binding,GTP binding,protein domain specific binding,identical protein binding	I3LD72	EHD2	EH domain containing 2	NaN	NaN	3.852898E+07	2.676921E+07	1.990879E+07	2.175837E+07	NaN	NaN	11	11	11	11
;;;	;;;	;;;	A0A286ZNM5;A0A287AXU7;A0A287B101;A0A287BGY3	TIAL1	Uncharacterized protein	NaN	NaN	4249754	2313122	5335450	3630805	NaN	NaN	2	2	2	2
;	;	;	A0A286ZPI8;A0A286ZVF5	CD55	Uncharacterized protein	NaN	NaN	204990.8	7652948	NaN	NaN	NaN	NaN	4	4	NaN	NaN
;	;	calcium ion binding;	A0A287BGV1;A0A5G2R0I5	LTBP4	Latent transforming growth factor beta binding protein 4	NaN	NaN	6560708	3847061	3733147	4805747	NaN	NaN	1	1	1	1
			A0A5G2QDK9	NDUFAF7	Protein arginine methyltransferase NDUFAF7	NaN	NaN	4515718	1.268166E+07	2101213	9833738	NaN	NaN	6	6	6	6
cytoplasm	protein phosphorylation,negative regulation of protein kinase activity,negative regulation of phosphatase activity	protein serine/threonine kinase activity,protein kinase inhibitor activity,ATP binding,phosphatase binding	Q6R2V0	WNK1	Serine/threonine-protein kinase WNK1	NaN	NaN	1150651	4514428	9882175	1086415	NaN	NaN	4	4	4	4
;mitochondrion,lysosome,early endosome,late endosome,cytosol,endosome membrane,postsynaptic density,retromer complex,retromer, cargo-selective complex,neuron projection,neuronal cell body,perinuclear region of cytoplasm,tubular endosome,mitochondrion-derived vesicle	;intracellular protein transport,lysosome organization,positive regulation of gene expression,negative regulation of gene expression,protein destabilization,negative regulation of protein homooligomerization,protein localization to organelle,retrograde transport, endosome to Golgi,mitochondrial fragmentation involved in apoptotic process,transcytosis,negative regulation of inflammatory response,voluntary musculoskeletal movement,positive regulation of dopamine receptor signaling pathway,positive regulation of Wnt protein secretion,positive regulation of mitochondrial fission,positive regulation of canonical Wnt signaling pathway,positive regulation of locomotion involved in locomotory behavior,mitochondrion to lysosome transport,neurotransmitter receptor transport, endosome to plasma membrane,negative regulation of neuron death,negative regulation of late endosome to lysosome transport,regulation of dendritic spine maintenance,positive regulation of dopamine biosynthetic process,positive regulation of cellular protein catabolic process,negative regulation of cellular protein localization,negative regulation of lysosomal protein catabolic process,regulation of terminal button organization	;protein transporter activity,D1 dopamine receptor binding	A0A5G2QTZ1;I3LBB2	VPS35	Vacuolar protein sorting-associated protein 35	NaN	NaN	2.087941E+07	9907870	2737478	1.201034E+07	NaN	NaN	9	9	9	9
;extracellular matrix	;blood coagulation	;calcium ion binding	A0A5G2QVC8;F1RW71	MMRN1	Multimerin 1	NaN	NaN	128943.1	NaN	NaN	NaN	NaN	NaN	1	NaN	NaN	NaN
;	;	;	A0A287B7A0;F1SFF4	RTRAF	RNA transcription, translation and transport factor protein;RNA transcription, translation and transport factor protein	NaN	NaN	394868.5	6854541	3557281	921150.4	NaN	NaN	2	2	2	2
;;;endosome	;;;actin cytoskeleton organization,regulation of endocytosis,caveola assembly,membrane tubulation	;;;	A0A287A178;A0A287BR41;A0A480MPL1;F1SJR5	PACSIN2	Protein kinase C and casein kinase substrate in neurons 2	NaN	NaN	93656.69	1411397	NaN	411160.7	NaN	NaN	3	3	NaN	3
;;;;;	;;;;;	;;;;;	A0A287AE62;A0A5G2QE05;A0A5G2QKM3;A0A5G2QS31;A0A5G2R8G0;A0A5G2RIF5	TBCE	Tubulin-specific chaperone E;Uncharacterized protein;Tubulin-folding cofactor E;Tubulin-specific chaperone E;Tubulin-folding cofactor E;Tubulin-specific chaperone E	NaN	NaN	1.144044E+07	NaN	NaN	NaN	NaN	NaN	2	NaN	NaN	NaN
			A0A287A271	HSPB3	SHSP domain-containing protein	NaN	NaN	70659.98	2023995	2019440	2304840	NaN	NaN	2	2	2	2
;cytosol,translation release factor complex	;cytoplasmic translational termination,protein methylation	;translation release factor activity,GTPase activity,GTP binding	A0A287AMP7;I3LNK5	GSPT1	G1 to S phase transition 1;Eukaryotic peptide chain release factor GTP-binding subunit ERF3A isoform 1	NaN	NaN	203272.2	179824.3	NaN	NaN	NaN	NaN	1	1	NaN	NaN
cytosol	gluconeogenesis,glycolytic process,regulation of pentose-phosphate shunt	bisphosphoglycerate mutase activity,2,3-bisphosphoglycerate-dependent phosphoglycerate mutase activity	B5KJG2	PGAM2	Phosphoglycerate mutase	NaN	NaN	791543.6	1823087	117429.2	1098727	NaN	NaN	1	1	1	1
nucleus;;;;;transcription factor complex,NuRD complex;nucleus,cytoplasm;	regulation of transcription, DNA-templated;;;;;negative regulation of transcription from RNA polymerase II promoter,DNA methylation,histone deacetylation,positive regulation of transcription from RNA polymerase II promoter;positive regulation of cell proliferation,positive regulation of G2/M transition of mitotic cell cycle,negative regulation of transcription, DNA-templated;	chromatin binding,transcription factor activity, sequence-specific DNA binding,zinc ion binding,sequence-specific DNA binding;;;;;transcription regulatory region sequence-specific DNA binding,transcription factor activity, transcription factor binding,RNA polymerase II repressing transcription factor binding,chromatin binding,transcription factor activity, sequence-specific DNA binding,histone deacetylase activity,zinc ion binding;DNA binding,chromatin binding;	A0A286ZS52;A0A287AYU1;A0A5G2QRU2;A0A5G2QVV5;A0A5G2QYW0;F1RPX1;F1S4V2;I3LTS3	MTA1;MTA2;MTA1;MTA1;MTA1;MTA2;MTA3;MTA3	Metastasis associated 1;Metastasis associated 1 family member 2;Metastasis associated 1;Metastasis associated 1;Metastasis associated 1;Metastasis associated 1 family member 2;Metastasis associated 1 family member 3;Metastasis associated 1 family member 3	NaN	NaN	22741.74	NaN	NaN	NaN	NaN	NaN	1	NaN	NaN	NaN
;;;;extracellular space,extracellular matrix	;;;;fibril organization	;;;;calcium ion binding	A0A287BDJ6;A0A5G2QLH2;A0A5G2QZZ4;A0A5G2R7P3;F1S2T5	LTBP2	Latent-transforming growth factor beta-binding protein 2;Latent transforming growth factor beta binding protein 2;Latent transforming growth factor beta binding protein 2;Latent transforming growth factor beta binding protein 2;Latent transforming growth factor beta binding protein 2	NaN	NaN	1695630	5325998	2344319	908134.1	NaN	NaN	13	13	13	13
;;;	;regulation of transcription, DNA-templated;;	;RNA binding;;	A0A286ZY30;A0A287BLB3;A0A5G2QF76;A0A5G2QQU4	KHSRP	KH-type splicing regulatory protein	NaN	NaN	2.087131E+07	2.025197E+07	8322719	1.60099E+07	NaN	NaN	5	5	5	5
;extracellular space,Golgi apparatus,extracellular matrix;extracellular matrix,blood microparticle	;ossification,acute-phase response,negative regulation of endopeptidase activity,negative regulation of bone mineralization,regulation of inflammatory response,positive regulation of phagocytosis;acute-phase response,negative regulation of endopeptidase activity,negative regulation of bone mineralization,regulation of inflammatory response,positive regulation of phagocytosis,negative regulation of biomineral tissue development	;cysteine-type endopeptidase inhibitor activity;endopeptidase inhibitor activity,cysteine-type endopeptidase inhibitor activity	A0A287BDE8;F1SFI7;P29700	AHSG	Alpha-2-HS-glycoprotein;Alpha-2-HS-glycoprotein;Alpha-2-HS-glycoprotein (Fragment)	NaN	NaN	5234049	844985.5	4096697	5653398	NaN	NaN	2	2	2	2
;;	;;	;RNA binding;	A0A287A658;A0A287B6U9;A0A480U8W8	YTHDF3	YTH N6-methyladenosine RNA binding protein 3	NaN	NaN	1007747	276853.8	408607.1	620425.9	NaN	NaN	1	1	1	1
spectrin;;;	cytoskeleton organization,actin filament capping;;;	actin binding,structural constituent of cytoskeleton,phospholipid binding;;;	A0A287A113;A0A5G2QHL5;A0A5G2QSV4;F1SA60	SPTB	Spectrin beta chain	NaN	NaN	7647.302	3.183899E+07	NaN	5.391355E+07	NaN	NaN	2	2	NaN	2
			A0A287AJQ2	PGAM1	Phosphoglycerate mutase	NaN	NaN	1.820279E+07	5989054	1.493326E+07	1.820813E+07	NaN	NaN	4	4	4	4
			A0A287BLR0	PYGL	Alpha-1,4 glucan phosphorylase	NaN	NaN	1090790	9143442	NaN	NaN	NaN	NaN	5	5	NaN	NaN
mitochondrion	tricarboxylic acid cycle	magnesium ion binding,isocitrate dehydrogenase (NAD+) activity,NAD binding	A0A286ZQY6	IDH3A	Isocitrate dehydrogenase [NAD] subunit, mitochondrial	NaN	NaN	8019342	1.410094E+07	1.495616E+07	1.320747E+07	NaN	NaN	4	4	4	4
	proteolysis	peptidase activity	F6Q194	FGL2	Fibrinogen like 2	NaN	NaN	145194	1257654	NaN	2125029	NaN	NaN	2	2	NaN	2
cytosol,actin cytoskeleton	glycogen biosynthetic process,glucose metabolic process,galactose catabolic process	magnesium ion binding,phosphoglucomutase activity	F1S814	PGM1	Phosphoglucomutase 1	NaN	NaN	3482626	2264203	3440145	1170513	NaN	NaN	10	10	10	10
fascia adherens,cell surface,postsynaptic density,integral component of membrane,basolateral plasma membrane,apical plasma membrane,catenin complex,lamellipodium,cortical actin cytoskeleton,extracellular matrix,sarcolemma,plasma membrane raft	homophilic cell adhesion via plasma membrane adhesion molecules,heterophilic cell-cell adhesion via plasma membrane cell adhesion molecules,calcium-dependent cell-cell adhesion via plasma membrane cell adhesion molecules,cell migration,cerebral cortex development,positive regulation of MAPK cascade,cell-cell adhesion mediated by cadherin,blood vessel morphogenesis,brain morphogenesis,homeostasis of number of cells,striated muscle cell differentiation,radial glial cell differentiation,neuroepithelial cell differentiation,regulation of oligodendrocyte progenitor proliferation,protein localization to plasma membrane,negative regulation of canonical Wnt signaling pathway,neuroligin clustering involved in postsynaptic membrane assembly,neuronal stem cell population maintenance,regulation of postsynaptic density protein 95 clustering,positive regulation of synaptic vesicle clustering	calcium ion binding,beta-catenin binding,protein kinase binding,protein phosphatase binding,identical protein binding,alpha-catenin binding,gamma-catenin binding	F1SAM3	CDH2	Cadherin-2	NaN	NaN	2548868	1615650	314233.6	224465.7	NaN	NaN	5	5	5	5
mitochondrial respiratory chain complex I	mitochondrial respiratory chain complex I assembly		F1SV23	NDUFS5	Complex I-15 kDa	NaN	NaN	1347819	NaN	NaN	495397.3	NaN	NaN	1	NaN	NaN	1
;;cytosol,AP-1 adaptor complex,recycling endosome	;;intracellular protein transport,endosome to melanosome transport,positive regulation of natural killer cell degranulation,Golgi to lysosome transport	;;Rab GTPase binding,kinesin binding,GTP-dependent protein binding	A0A5G2R4F8;A0A5K1VTT2;F1S3C7	AP1G1	AP-1 complex subunit gamma;AP-1 complex subunit gamma;Adaptor related protein complex 1 subunit gamma 1	NaN	NaN	559388.6	NaN	NaN	NaN	NaN	NaN	1	NaN	NaN	NaN
mitochondrial respiratory chain complex I	mitochondrial respiratory chain complex I assembly		I3LDC3	NDUFB10	Complex I-PDSW	NaN	NaN	1367713	NaN	NaN	2227028	NaN	NaN	1	NaN	NaN	1
;nucleolus,cytosol,mitochondrial membrane,mitochondrial nucleoid	;temperature homeostasis,response to cold,epithelial cell differentiation,fatty acid beta-oxidation using acyl-CoA dehydrogenase,negative regulation of fatty acid biosynthetic process,negative regulation of fatty acid oxidation,regulation of cholesterol metabolic process	;long-chain-acyl-CoA dehydrogenase activity,flavin adenine dinucleotide binding	A0A5G2R3E4;F1ST43	ACADVL	Acyl-CoA dehydrogenase very long chain	NaN	NaN	5652147	125943.6	NaN	415572.5	NaN	NaN	3	3	NaN	3
intracellular		pyridoxal phosphate binding	F1RX84	PLPBP	Pyridoxal phosphate homeostasis protein	NaN	NaN	2715199	1807416	3.356173E+07	1095280	NaN	NaN	1	1	1	1
;;;;U5 snRNP,U1 snRNP,U2 snRNP,U4 snRNP,cytoplasm,U4/U6 x U5 tri-snRNP complex,U2-type prespliceosome,catalytic step 2 spliceosome	;;;;mRNA splicing, via spliceosome	;;;;RNA binding	A0A286ZSF8;A0A287AG39;A0A287AT45;A0A287BQ44;I3LBT8	SNRPN;;SNRPN;SNRPN;SNRPN	Small nuclear ribonucleoprotein-associated protein	NaN	NaN	4268819	3924849	6366087	1047436	NaN	NaN	2	2	2	2
;;;cytoplasm,cytosol	;;;cellular response to oxidative stress,cell redox homeostasis,oxidation-reduction process,cellular oxidant detoxification	;;;thioredoxin-disulfide reductase activity,protein disulfide oxidoreductase activity,oxidoreductase activity, acting on a sulfur group of donors, disulfide as acceptor,protein-disulfide reductase activity	A0A287AVP4;A0A287BG87;A0A287BP50;F1S1X9	TXNL1	Thioredoxin like 1	NaN	NaN	377350.1	652257.5	139732.8	NaN	NaN	NaN	1	1	1	NaN
			A0A287AL10	FTH1	Ferritin	NaN	NaN	2052956	4171572	2011740	2066524	NaN	NaN	4	4	4	4
;;;	;;;	;;;RNA binding	A0A286ZIN0;A0A287AAI4;A0A480M1B4;F1RVC9	HNRNPD	Heterogeneous nuclear ribonucleoprotein D	NaN	NaN	6.110584E+07	2388125	3.637321E+07	786960.9	NaN	NaN	2	2	2	2
;phosphopyruvate hydratase complex;;	;glycolytic process;;	;magnesium ion binding,phosphopyruvate hydratase activity;;	A0A287A8S8;A0A287B6S5;A0A480WPU1;I3LK59	ENO1	2-phospho-D-glycerate hydro-lyase	NaN	NaN	9229267	3750281	745494.3	1040413	NaN	NaN	3	3	3	3
;;;;;	;;;;;ubiquitin-dependent protein catabolic process,protein deubiquitination	;;;;;thiol-dependent ubiquitinyl hydrolase activity	A0A286ZV91;A0A287A4C3;A0A287A594;A0A287B4A2;F1SAF6;I3LI16	USP2	Ubiquitin carboxyl-terminal hydrolase;Ubiquitin specific peptidase 2;Ubiquitin specific peptidase 2;Ubiquitin specific peptidase 2;Ubiquitin carboxyl-terminal hydrolase;Ubiquitin carboxyl-terminal hydrolase	NaN	NaN	503339.9	24721.57	NaN	62969.74	NaN	NaN	2	2	NaN	2
;;;;;;;;	;apoptotic signaling pathway,regulation of NIK/NF-kappaB signaling;;;;;;;	;;;;;;;;	A0A287A4D9;A0A287A6Z5;A0A287ABL8;A0A287AKH9;A0A287AU41;A0A287B7Y7;A0A287BH40;A0A5G2R266;F1SIT4	UACA	Uveal autoantigen with coiled-coil domains and ankyrin repeats	NaN	NaN	2638868	NaN	NaN	2313596	NaN	NaN	2	NaN	NaN	2
;	;	;	A0A286ZTD8;A0A5G2R6V9	CRK	Uncharacterized protein	NaN	NaN	2088935	NaN	904230.3	808427.3	NaN	NaN	2	NaN	2	2
;;;;;;;;;	metabolic process;;;;;;;;;	catalytic activity;;;;;;;;;	A0A287AIP7;A0A287BM44;A0A287BMY7;A0A480QCC9;A0A5G2QBV9;A0A5G2QCS2;A0A5G2QI99;A0A5G2R2U1;A0A5G2RDH5;F1RSZ3	ACSL1	Arachidonate--CoA ligase;Arachidonate--CoA ligase;Arachidonate--CoA ligase;Arachidonate--CoA ligase;Arachidonate--CoA ligase;Arachidonate--CoA ligase;Arachidonate--CoA ligase;Acyl-CoA synthetase long chain family member 1;Arachidonate--CoA ligase;Arachidonate--CoA ligase	NaN	NaN	1853073	302628.9	NaN	1745868	NaN	NaN	2	2	NaN	2
			F1REW5	CLIP1	CAP-Gly domain containing linker protein 1	NaN	NaN	4.886812E+07	5.130567E+07	1.211958E+07	1.765254E+07	NaN	NaN	12	12	12	12
;;;;;;cytosol	branched-chain amino acid biosynthetic process;;;;;;steroid catabolic process,oxidation-reduction process	L-leucine transaminase activity,L-valine transaminase activity,L-isoleucine transaminase activity;;;;;;estradiol 17-beta-dehydrogenase activity,identical protein binding,testosterone 17-beta-dehydrogenase (NADP+) activity	A0A287BER5;A0A5G2Q7R9;A0A5G2Q850;A0A5G2QNV2;A0A5G2RDA5;F1RL80;F1RL81	BCAT2	Branched-chain-amino-acid aminotransferase;Branched-chain-amino-acid aminotransferase;Branched-chain-amino-acid aminotransferase;Branched-chain-amino-acid aminotransferase;Branched-chain-amino-acid aminotransferase;Branched-chain-amino-acid aminotransferase;Branched-chain-amino-acid transaminase	NaN	NaN	786596.4	2343993	1323849	1296578	NaN	NaN	2	2	2	2
			A0A287BNL5	NaN	Uncharacterized protein	NaN	NaN	107308.6	7490614	NaN	NaN	NaN	NaN	6	6	NaN	NaN
;	acetyl-CoA biosynthetic process from acetate;	acetate-CoA ligase activity,AMP binding;	A0A287BEZ5;F1S4Y0	ACSS2	Propionate--CoA ligase	NaN	NaN	515229.7	430880.7	NaN	524495.7	NaN	NaN	2	2	NaN	2
cytoplasm,cytoskeleton,cell junction,sarcolemma,postsynaptic membrane		dystroglycan binding,actin binding,zinc ion binding	Q5GN48	DMD	Dystrophin	NaN	NaN	2103569	6569281	1083938	155381.3	NaN	NaN	2	2	2	2
;;;;	;;;;	;;;;	A0A286ZSP8;A0A287ARI8;A0A287B6E4;A0A5G2QQM3;A0A5G2QTL6	NaN	Gamma-interferon-inducible protein 16 isoform 1;Uncharacterized protein;Uncharacterized protein;Uncharacterized protein;Uncharacterized protein	NaN	NaN	2037823	4288816	911993.2	1662137	NaN	NaN	5	5	5	5
extracellular space	neural crest cell migration,somitogenesis,blood vessel remodeling,outflow tract septum morphogenesis,cardiac right ventricle morphogenesis,pulmonary myocardium development,axon guidance,post-embryonic development,neural tube development,negative chemotaxis,limb bud formation,dichotomous subdivision of terminal units involved in salivary gland branching,semaphorin-plexin signaling pathway,Requires Ontology,positive regulation of cardiac neural crest cell migration involved in outflow tract morphogenesis	semaphorin receptor binding,neuropilin binding	I3LBD8	SEMA3C	Semaphorin-3C	NaN	NaN	1285845	NaN	NaN	NaN	NaN	NaN	1	NaN	NaN	NaN
nucleus,cytoplasm,mitochondrion,cytosol,prefoldin complex	protein folding,positive regulation of cytoskeleton organization	protein binding involved in protein folding,unfolded protein binding	F1S192	PFDN2	Prefoldin subunit 2	NaN	NaN	4760251	3078491	909923.4	1510583	NaN	NaN	2	2	2	2
;;cytoplasm	;;nucleoside diphosphate phosphorylation,nucleoside triphosphate biosynthetic process,ATP metabolic process	;;adenylate kinase activity,nucleoside diphosphate kinase activity,ATP binding	A0A286ZQ79;A0A5S6G079;P00571	AK1	Adenylate kinase isoenzyme 1	NaN	NaN	979116.3	2262747	243402.3	7397274	NaN	NaN	3	3	3	3
caveola	termination of RNA polymerase I transcription		A0A286ZZ97	CAVIN1	Caveolae associated protein 1	NaN	NaN	2.36815E+07	1.612896E+07	7590514	9250859	NaN	NaN	10	10	10	10
;;;ESCRT II complex,lysosome,late endosome membrane	;;;protein targeting to vacuole involved in ubiquitin-dependent protein catabolic process via the multivesicular body sorting pathway	;;;phosphatidylinositol-3-phosphate binding,ubiquitin binding	A0A286ZW46;A0A287B6V1;A0A5G2RBF7;F1RMD6	VPS36	Vacuolar protein-sorting-associated protein 36	NaN	NaN	670827	1092520	5999315	NaN	NaN	NaN	1	1	1	NaN
;	;	RNA binding;	A0A287BH67;A0A287BSU8	SRSF4	Uncharacterized protein	NaN	NaN	3737588	1.772681E+07	1.158565E+07	2836642	NaN	NaN	5	5	5	5
cytosol	response to heat,positive regulation of ATPase activity,protein refolding	ATPase activator activity,ATP binding,heat shock protein binding,unfolded protein binding,chaperone binding	F1RP05	DNAJA2	DnaJ heat shock protein family (Hsp40) member A2	NaN	NaN	3797315	1641958	3687480	3912722	NaN	NaN	3	3	3	3
;Golgi membrane,COPII vesicle coat;	;in utero embryonic development,intracellular protein transport,cargo loading into COPII-coated vesicle;	;SNARE binding,zinc ion binding;	A0A5G2QQZ3;F1S155;I3L9C3	SEC24D	SEC24 homolog D, COPII coat complex component;SEC24 homolog D, COPII coat complex component;SEC24 homolog D, COPII coat complex component	NaN	NaN	1827914	926693.2	2367405	NaN	NaN	NaN	3	3	3	NaN
nucleoplasm,membrane	cell surface receptor signaling pathway,positive regulation of signal transduction,negative regulation of transcription, DNA-templated,positive regulation of translational initiation,positive regulation of RNA export from nucleus,regulation of mRNA splicing, via spliceosome,protein oligomerization	SH3/SH2 adaptor activity,poly(A) binding,poly(U) RNA binding,protein domain specific binding,identical protein binding	I3LP11	KHDRBS1	KH RNA binding domain containing, signal transduction associated 1	NaN	NaN	1519697	9.689382E+07	4740898	2144468	NaN	NaN	2	2	2	2
mitochondrion,peroxisome	oxidation-reduction process	3-keto sterol reductase activity,carbonyl reductase (NADPH) activity,identical protein binding	Q8WNV7	DHRS4	Dehydrogenase/reductase SDR family member 4	NaN	NaN	2.69621E+07	1.073103E+07	5.09301E+07	5.35001E+07	NaN	NaN	11	11	11	11
;;nucleus,nucleolus,cytoplasm,chromatoid body	;;spermatid development,tRNA methylation,meiotic cell cycle checkpoint,hair follicle maturation	;;tRNA binding,tRNA (cytosine-5-)-methyltransferase activity	A0A5G2QRK5;A0A5G2QSP5;F1S0R7	NSUN2	NOL1/NOP2/Sun domain family member 2	NaN	NaN	145163	445455.4	1170466	77208.67	NaN	NaN	3	3	3	3
;;nucleus	;;regulation of transcription, DNA-templated	;;DNA binding,transcription factor activity, sequence-specific DNA binding	A0A286ZWB0;A0A287AJL6;A0A287AVH0	CREB1	Cyclic AMP-responsive element-binding protein 1 isoform B;cAMP responsive element binding protein 1;cAMP responsive element binding protein 1	NaN	NaN	3.829043E+07	6.930384E+09	3.577372E+07	NaN	NaN	NaN	2	2	2	NaN
intracellular;;;;	lipid catabolic process,intracellular signal transduction;;;;	phosphatidylinositol phospholipase C activity,signal transducer activity,calcium ion binding;;;;	A0A287A266;A0A287AW05;A0A287B1F3;A0A287BIJ7;F1SBL0	PLCB4	1-phosphatidylinositol 4,5-bisphosphate phosphodiesterase;1-phosphatidylinositol 4,5-bisphosphate phosphodiesterase;1-phosphatidylinositol 4,5-bisphosphate phosphodiesterase;1-phosphatidylinositol 4,5-bisphosphate phosphodiesterase;1-phosphatidylinositol 4,5-bisphosphate phosphodiesterase	NaN	NaN	41797.45	NaN	NaN	NaN	NaN	NaN	1	NaN	NaN	NaN
;;nucleolus,mitochondrial inner membrane,mitochondrial respiratory chain complex II, succinate dehydrogenase complex (ubiquinone),myelin sheath,plasma membrane succinate dehydrogenase complex	;;tricarboxylic acid cycle,succinate metabolic process,mitochondrial electron transport, succinate to ubiquinone,nervous system development,anaerobic respiration,respiratory electron transport chain,oxidation-reduction process	;;protein binding,succinate dehydrogenase (ubiquinone) activity,electron carrier activity,flavin adenine dinucleotide binding	A0A5G2Q7D7;A0A5G2QMG3;Q0QF01	SDHA	Succinate dehydrogenase [ubiquinone] flavoprotein subunit, mitochondrial;Succinate dehydrogenase [ubiquinone] flavoprotein subunit, mitochondrial;Succinate dehydrogenase [ubiquinone] flavoprotein subunit, mitochondrial	NaN	NaN	3229798	8302965	7291294	1.431515E+07	NaN	NaN	9	9	9	9
;;;	proteolysis;;;	peptidase activity;;;	A0A287A826;A0A287ANN1;A0A287AWN4;F1SS80	ADAMTSL4	ADAMTS like 4	NaN	NaN	4736760	NaN	1618785	3539155	NaN	NaN	1	NaN	1	1
cytoplasm;;;	peptidyl-tyrosine dephosphorylation;;;	protein tyrosine phosphatase activity;;;	A0A287AQB6;A0A480ERB4;A0A5G2QDD3;A0A5G2RBQ6	PTPN11	Protein tyrosine phosphatase non-receptor type 11;Tyrosine-protein phosphatase non-receptor type;Tyrosine-protein phosphatase non-receptor type;Protein-tyrosine-phosphatase	NaN	NaN	4239699	NaN	3926441	2382664	NaN	NaN	2	NaN	2	2
;;	;;	;;	A0A286ZXE3;A0A5G2R231;K7GMH0	LOC100736765	Uncharacterized protein	NaN	NaN	5.854534E+07	1.535922E+07	3.823542E+07	1.696818E+07	NaN	NaN	5	5	5	5
;;nucleoplasm	;;RNA processing,response to virus	;;enzyme binding	A0A5G2QT53;A0A5G2QXJ5;I3LU51	HNRNPUL1	Heterogeneous nuclear ribonucleoprotein U like 1	NaN	NaN	883727.6	553006.4	353434.4	614471.9	NaN	NaN	3	3	3	3
;cytoskeleton;	;;	;;	A0A286ZR45;A0A287AI37;F1S8P9	ADD1	Adducin 1	NaN	NaN	1121488	125807.2	397426.3	NaN	NaN	NaN	3	3	3	NaN
extracellular space,cytoplasm	regulation of phosphorylation,cell motility,positive regulation of synapse assembly,vocalization behavior,positive regulation of cell migration involved in sprouting angiogenesis,cell-cell adhesion	receptor binding,hepatocyte growth factor binding,identical protein binding	F1S1M3	SRPX2	Sushi repeat-containing protein SRPX2	NaN	NaN	5960883	1.012958E+07	2539947	3608333	NaN	NaN	1	1	1	1
microtubule;;	cytoskeleton organization,microtubule-based process;;	GTPase activity,structural constituent of cytoskeleton,GTP binding;;	A0A287A217;A0A287A275;A0A5G2QGK1	TUBB4B	Tubulin beta 4B class IVb;Tubulin beta chain;Tubulin beta chain	NaN	NaN	9258606	1.518512E+07	6640616	1.641018E+07	NaN	NaN	2	2	2	2
;integral component of membrane;;	;metabolic process;;	;carboxylic ester hydrolase activity;;	A0A286ZLI9;A0A287A310;A0A5G2RBP2;F1SH10	NCEH1	Neutral cholesterol ester hydrolase 1	NaN	NaN	1.377608E+07	1.293943E+08	1.838739E+07	2.1618E+07	NaN	NaN	7	7	7	7
nucleus,cytoplasm;;	protein import into nucleus;;	protein transporter activity,nuclear import signal receptor activity;;	A0A287AEI6;A0A5G2Q7J1;A0A5G2QUV4	KPNA6	Importin subunit alpha	NaN	NaN	3.028179E+08	5.324403E+08	2.819203E+09	NaN	NaN	NaN	5	5	5	NaN
eukaryotic translation initiation factor 3 complex,eukaryotic 43S preinitiation complex,eukaryotic 48S preinitiation complex	formation of cytoplasmic translation initiation complex	translation initiation factor activity	A0A287ARI1	EIF3F	Eukaryotic translation initiation factor 3 subunit F	NaN	NaN	908868.9	834438.9	622984.6	778546.5	NaN	NaN	1	1	1	1
;;;;	;;;;	;;;;carbohydrate binding	A0A5G2QE07;A0A5G2QFK8;A0A5G2R7M4;F6Q8W1;K7GRV5	LGALS3	Galectin	NaN	NaN	307385.2	953559.8	NaN	NaN	NaN	NaN	1	1	NaN	NaN
;	oxidation-reduction process;	oxidoreductase activity, acting on the CH-OH group of donors, NAD or NADP as acceptor,NAD binding;	A0A287A5I0;A0A287AM09	CTBP1	C-terminal binding protein 1	NaN	NaN	15903.38	130886.7	70965.44	NaN	NaN	NaN	2	2	2	NaN
