PG.CellularComponent	PG.BiologicalProcess	PG.MolecularFunction	PG.UniprotIds	PG.Genes	PG.ProteinDescriptions	20220526_MK_LB_PB_E1200_15cm_noFAIMS_Fa2a_500ng.raw.PG.Label-Free Quant	20220526_MK_LB_PB_E1200_15cm_noFAIMS_Fa1a_500ng.raw.PG.Label-Free Quant	20220526_MK_LB_PB_E1200_15cm_noFAIMS_T4_500ng.raw.PG.Label-Free Quant	20220526_MK_LB_PB_E1200_15cm_noFAIMS_T3_500ng.raw.PG.Label-Free Quant	20220526_MK_LB_PB_E1200_15cm_noFAIMS_T2_500ng.raw.PG.Label-Free Quant	20220526_MK_LB_PB_E1200_15cm_noFAIMS_T1_500ng.raw.PG.Label-Free Quant	20220526_MK_LB_PB_E1200_15cm_noFAIMS_Fa2a_500ng.raw.PG.UniquePeptides	20220526_MK_LB_PB_E1200_15cm_noFAIMS_Fa1a_500ng.raw.PG.UniquePeptides	20220526_MK_LB_PB_E1200_15cm_noFAIMS_T4_500ng.raw.PG.UniquePeptides	20220526_MK_LB_PB_E1200_15cm_noFAIMS_T3_500ng.raw.PG.UniquePeptides	20220526_MK_LB_PB_E1200_15cm_noFAIMS_T2_500ng.raw.PG.UniquePeptides	20220526_MK_LB_PB_E1200_15cm_noFAIMS_T1_500ng.raw.PG.UniquePeptides
;nucleus,cleavage furrow,stereocilium;nucleus,cytoplasm,mitochondrion,endosome,cytosol,plasma membrane,focal adhesion,cell cortex,membrane,lamellipodium,axon,vesicle,cleavage furrow,ruffle membrane,apical junction complex,extracellular exosome,cell periphery,meiotic spindle;	;mitotic cytokinesis,small GTPase mediated signal transduction,positive regulation of protein homooligomerization,apical junction assembly,wound healing, spreading of cells,positive regulation of lipase activity,skeletal muscle satellite cell migration;meiotic spindle organization,cell morphogenesis,alpha-beta T cell lineage commitment,regulation of transcription from RNA polymerase II promoter,cytoskeleton organization,cell adhesion,cell-matrix adhesion,Rho protein signal transduction,skeletal muscle tissue development,regulation of neuron projection development,cerebral cortex cell migration,forebrain radial glial cell differentiation,actin cytoskeleton organization,cell differentiation,positive regulation of cell growth,regulation of cell migration,androgen receptor signaling pathway,positive regulation of actin filament polymerization,establishment or maintenance of actin cytoskeleton polarity,stress-activated protein kinase signaling cascade,positive regulation of cytokinesis,regulation of actin cytoskeleton organization,negative regulation of intracellular steroid hormone receptor signaling pathway,regulation of osteoblast proliferation,cleavage furrow formation,apolipoprotein A-I-mediated signaling pathway,embryonic cleavage,polar body extrusion after meiotic divisions,response to drug,negative regulation of I-kappaB kinase/NF-kappaB signaling,stress fiber assembly,positive regulation of cysteine-type endopeptidase activity involved in apoptotic process,apical junction assembly,beta selection,negative regulation of neuron apoptotic process,positive regulation of neuron apoptotic process,ossification involved in bone maturation,wound healing, spreading of cells,negative regulation of neuron differentiation,positive regulation of neuron differentiation,positive regulation of smooth muscle contraction,GTP metabolic process,positive regulation of alpha-beta T cell differentiation,regulation of dendrite development,negative chemotaxis,positive regulation of stress fiber assembly,spindle localization,regulation of calcium ion transport,positive regulation of lipase activity,negative regulation of cell death,trabecula morphogenesis,regulation of microtubule cytoskeleton organization,positive regulation of podosome assembly,mitotic spindle assembly,negative regulation of oxidative phosphorylation,skeletal muscle satellite cell migration,negative regulation of reactive oxygen species biosynthetic process,regulation of neural precursor cell proliferation;	;GTPase activity,GTP binding;GTPase activity,GTP binding,myosin binding,GDP binding,protein domain specific binding,Rho GDP-dissociation inhibitor binding;	A0A5G2QN15;F2Z5K4;I3LVS7;Q06AT8	RHOC;RHOC;RHOA;RHOB	Ras homolog family member C;Ras homolog family member C;Ras homolog family member A;RHOB	NaN	NaN	104044.1	NaN	NaN	NaN	NaN	NaN	1	NaN	NaN	NaN
extracellular region;;extracellular space	negative regulation of peptidase activity;;immune response,negative regulation of endopeptidase activity,antibacterial humoral response,response to lipopolysaccharide,innate immune response	peptidase inhibitor activity;;serine-type endopeptidase inhibitor activity	A0A287A5Z2;A0A480MVF5;P22298	SLPI	Antileukoproteinase;Antileukoproteinase;Antileukoproteinase (Fragment)	NaN	NaN	47722.09	NaN	NaN	NaN	NaN	NaN	1	NaN	NaN	NaN
nucleus,cytoplasm	negative regulation of cAMP-dependent protein kinase activity	cAMP-dependent protein kinase inhibitor activity	Q71U53	PKIA	cAMP-dependent protein kinase inhibitor alpha	NaN	NaN	1253594	NaN	NaN	NaN	NaN	NaN	1	NaN	NaN	NaN
;endoplasmic reticulum membrane,integral component of membrane;;;	;;;;	;;;;	A0A286ZT48;A0A287B5Q4;A0A5G2QA41;A0A5G2R927;F1SQK1	RTN4	Reticulon	NaN	NaN	159420.6	1735315	NaN	NaN	NaN	NaN	3	3	NaN	NaN
;	;	;	A0A480PWK6;A0A5G2R6T0	DOK7	Docking protein 7	NaN	NaN	1.307942E+07	7320661	327241.7	111906.5	NaN	NaN	2	2	2	2
;;U2 snRNP,U12-type spliceosomal complex,nuclear speck,U11/U12 snRNP,U2-type prespliceosome,catalytic step 2 spliceosome	;;spliceosomal complex assembly	;;mRNA binding	A0A286ZHW0;A0A287AV35;F1SMZ9	SF3B1	Splicing factor 3B subunit 1 isoform 1;Splicing factor 3b subunit 1;Splicing factor 3b subunit 1	NaN	NaN	741184.5	NaN	NaN	NaN	NaN	NaN	1	NaN	NaN	NaN
			F1RGH4	PROB1	Proline-rich basic protein 1	NaN	NaN	3208169	510206	1163242	84741.35	NaN	NaN	4	4	4	4
;;cytosol,integral component of membrane	;;oocyte maturation,cAMP catabolic process,cAMP-mediated signaling,cGMP-mediated signaling,regulation of meiotic nuclear division,response to drug,negative regulation of vascular permeability,positive regulation of vascular permeability,positive regulation of oocyte development,cellular response to cGMP,cellular response to transforming growth factor beta stimulus	;;3',5'-cyclic-AMP phosphodiesterase activity,metal ion binding	A0A287AWR3;A0A5G2R2C0;I3L6S5	PDE3A	Phosphodiesterase	NaN	NaN	1099136	147757.2	751210.1	NaN	NaN	NaN	1	1	1	NaN
	DNA dealkylation involved in DNA repair,oxidative single-stranded DNA demethylation	dioxygenase activity	A0A287B3Y6	ACCSL	Alpha-ketoglutarate-dependent dioxygenase alkB homolog 3	NaN	NaN	673140.9	NaN	450063.5	NaN	NaN	NaN	2	NaN	2	NaN
mitochondrial intermembrane space,respiratory chain	mitochondrial electron transport, ubiquinol to cytochrome c,mitochondrial electron transport, cytochrome c to oxygen,apoptotic process,positive regulation of cysteine-type endopeptidase activity involved in apoptotic process	electron carrier activity,heme binding,metal ion binding	P62895	CYCS	Cytochrome c	NaN	NaN	2.748235E+07	1679625	398363.1	4717885	NaN	NaN	3	3	3	3
granular component,extracellular space,cytoplasm,extracellular matrix	positive regulation of plasminogen activation,bone mineralization,cellular response to transforming growth factor beta stimulus	calcium ion binding,heparin binding,kringle domain binding	F1SRC8	CLEC3B	C-type lectin domain family 3 member B	NaN	NaN	1572351	2212853	2150443	NaN	NaN	NaN	2	2	2	NaN
			A0A286ZY90	OLFML1	Olfactomedin-like domain-containing protein	NaN	NaN	537036.1	NaN	NaN	1032877	NaN	NaN	2	NaN	NaN	2
;	transmembrane transport;	ATPase activity, coupled to transmembrane movement of substances;	A0A286ZJL5;A0A5G2QNQ4	ATP6V1D	V-type proton ATPase subunit D	NaN	NaN	211075.4	NaN	607416.4	NaN	NaN	NaN	2	NaN	2	NaN
;;;nucleus,cytoplasm,centrosome,cytosol	;;;G1/S transition of mitotic cell cycle,RNA export from nucleus,ubiquitin-dependent protein catabolic process,protein import into nucleus,spindle organization,positive regulation of GTPase activity,positive regulation of mitotic centrosome separation	;;;Ran GTPase binding,GTPase activator activity	A0A286ZJ82;A0A287BA60;A0A5G2QF65;F1RHM8	RANBP1	RAN binding protein 1	NaN	NaN	2479562	2010569	1080597	2848469	NaN	NaN	1	1	1	1
cytosol	response to stress,positive regulation of ATPase activity	ATPase activator activity,cadherin binding,chaperone binding	F1SE06	AHSA1	Activator of HSP90 ATPase activity 1	NaN	NaN	369086.3	476417.8	2182197	NaN	NaN	NaN	2	2	2	NaN
;;;	cell adhesion,actin cytoskeleton reorganization;;;	actin binding;;;	A0A287B7K9;A0A5G2QCR7;A0A5G2QJH9;A0A5G2R583	PARVA	Parvin alpha	NaN	NaN	2039505	2049231	3054364	1566591	NaN	NaN	4	4	4	4
;;;;;;	;oxidation-reduction process;;;;;	;oxidoreductase activity, acting on the CH-CH group of donors,hydrolase activity,flavin adenine dinucleotide binding;;;;;	A0A287A1Y0;A0A287AFL8;A0A287B6K7;A0A287B6W9;A0A287BEX2;F1RL48;I3LK34	ACAD10	Acyl-CoA dehydrogenase family member 10	NaN	NaN	42103.13	85711.44	50804.94	NaN	NaN	NaN	3	3	3	NaN
;;cytosol,membrane,nuclear speck,cortical cytoskeleton	;;regulation of neutrophil chemotaxis	;;	A0A5G2R7M5;F1RZ25;K7GP41	MPP1	55 kDa erythrocyte membrane protein	NaN	NaN	4126022	1810297	2144910	4160798	NaN	NaN	4	4	4	4
;;;COP9 signalosome	;;;protein deneddylation	;;;	A0A287A6E6;A0A287AAK1;A0A287AT16;A0A287BSE8	GPS1	G protein pathway suppressor 1	NaN	NaN	384470.9	429246.8	NaN	175855.4	NaN	NaN	2	2	NaN	2
mitochondrion,mitochondrial inner membrane	acetyl-CoA biosynthetic process,isoleucine catabolic process,fatty acid beta-oxidation,coenzyme A biosynthetic process,acetyl-CoA catabolic process,ketone body catabolic process,propionyl-CoA biosynthetic process	acetyl-CoA C-acetyltransferase activity,carbon-carbon lyase activity,ligase activity, forming carbon-carbon bonds	I3LP02	ACAT1	Acetyl-CoA acetyltransferase 1	NaN	NaN	8322748	1423055	4788810	2118914	NaN	NaN	4	4	4	4
;;;;;;	;;;;;;	;;;;;;	A0A286ZUD9;A0A287A3R7;A0A287B2K8;A0A287BAC9;A0A287BEM8;A0A287BH81;A0A287BSP9	KANK2	KN motif and ankyrin repeat domains 2	NaN	NaN	410936.6	941728.6	749254.2	982091.1	NaN	NaN	2	2	2	2
;nucleus,cytoplasm	;	;	A0A287AW94;A0A287BCD1	ADRM1	Uncharacterized protein	NaN	NaN	853864.4	NaN	251512.6	NaN	NaN	NaN	1	NaN	1	NaN
;;	plasma membrane organization,ruffle assembly;;	actin binding;;	A0A287ACA2;A0A287AQA4;A0A287BCH7	MTSS2	MTSS I-BAR domain containing 2	NaN	NaN	457013.4	NaN	NaN	NaN	NaN	NaN	1	NaN	NaN	NaN
;	;	;	A0A5G2QH28;A0A5G2R384	GMPR	GMP reductase	NaN	NaN	386004.4	318312.8	900071.9	NaN	NaN	NaN	1	1	1	NaN
intracellular;intracellular;;;;nuclear envelope,cytosol,actin filament,membrane,lamellipodium	small GTPase mediated signal transduction;small GTPase mediated signal transduction;;;;chemotaxis,actin filament organization,G-protein coupled receptor signaling pathway,small GTPase mediated signal transduction,positive regulation of cell proliferation,positive regulation of lamellipodium assembly,regulation of cell-substrate adhesion,cell projection assembly,regulation of T cell proliferation,regulation of mast cell degranulation,regulation of protein kinase activity,regulation of respiratory burst,regulation of mast cell chemotaxis,lymphocyte aggregation,positive regulation of neutrophil chemotaxis,positive regulation of protein targeting to mitochondrion	GTPase activity,GTP binding;GTPase activity,GTP binding;;;;GTPase activity,GTP binding,protein kinase regulator activity	A0A287ATV4;A0A287B4G4;A0A5G2QQK3;A0A5G2R1K1;A0A5G2R6S0;I3LKU0	RAC3;RAC1;RAC1;RAC2;RAC2;RAC2	Rac family small GTPase 3;Rac family small GTPase 1;Rac family small GTPase 1;Rac family small GTPase 2;Rac family small GTPase 2;Rac family small GTPase 2	NaN	NaN	155641.6	606530.1	NaN	NaN	NaN	NaN	1	1	NaN	NaN
	transcription, DNA-templated	metal ion binding	A0A287B6Q0	PHF3	PHD finger protein 3	NaN	NaN	1.423661E+08	1.063931E+08	4.532626E+07	1.338523E+08	NaN	NaN	1	1	1	1
			F1S5H7	NHLRC2	NHL repeat containing 2	NaN	NaN	287998	1245750	441065.8	124214.5	NaN	NaN	7	7	7	7
;;	;;	;;	A0A286ZS54;A0A287AI95;F1SEV7	GSDMD	Gasdermin D;Gasdermin D;Gasdermin-D	NaN	NaN	1303917	1017901	318116	183331.9	NaN	NaN	1	1	1	1
;cytoplasmic dynein complex;;	;microtubule-based movement;;	;microtubule motor activity;;	A0A287AVN3;A0A287BSZ9;A0A5G2QHF0;A0A5G2RAZ9	DYNC1LI2	Dynein light intermediate chain	NaN	NaN	5.082009E+07	3.797616E+07	229874.2	NaN	NaN	NaN	2	2	2	NaN
;membrane attack complex	;complement activation	;	A0A5G2QSU4;F1SMJ1	C7	Complement component C7	NaN	NaN	1.370631E+07	NaN	452481.2	NaN	NaN	NaN	1	NaN	1	NaN
nucleus;;;nucleus,PML body	protein sumoylation;;;protein sumoylation,positive regulation of proteasomal ubiquitin-dependent protein catabolic process	;;;transcription corepressor binding,protein tag,ubiquitin protein ligase binding	A0A287AD21;A0A5G2QGH3;A0A5G2QJK4;P61958	SUMO3;SUMO2;SUMO2;SUMO2	Small ubiquitin-related modifier;Small ubiquitin-related modifier 2;Small ubiquitin-related modifier;Small ubiquitin-related modifier 2	NaN	NaN	4109127	1.671054E+08	1.658862E+08	2.307866E+08	NaN	NaN	1	1	1	1
;	signal transduction;	;	A0A287AUI5;F1S146	ANK2	Uncharacterized protein	NaN	NaN	364439.3	353030.5	NaN	203779	NaN	NaN	2	2	NaN	2
	protein dephosphorylation	protein tyrosine/serine/threonine phosphatase activity	I3L5M7	DUSP28	Dual specificity phosphatase 28	NaN	NaN	302781.6	NaN	NaN	87714.64	NaN	NaN	1	NaN	NaN	1
extracellular region	proteolysis,blood coagulation,fibrinolysis,tissue remodeling,interaction with symbiont via secreted substance involved in symbiotic interaction	serine-type endopeptidase activity	P06867	PLG	Plasminogen	NaN	NaN	3.589719E+07	NaN	1240730	5663426	NaN	NaN	3	NaN	3	3
		protein domain specific binding	F2Z4Z1	YWHAG	14_3_3 domain-containing protein	NaN	NaN	1344656	3208199	236747.8	1680338	NaN	NaN	5	5	5	5
;Sin3 complex	;negative regulation of transcription from RNA polymerase II promoter,histone deacetylation	;RNA polymerase II transcription corepressor activity,histone deacetylase activity	A0A287BIZ0;F1SJ69	SIN3A	SIN3 transcription regulator family member A;Paired amphipathic helix protein Sin3a	NaN	NaN	8351587	NaN	NaN	164067.9	NaN	NaN	1	NaN	NaN	1
;intracellular;;;	;intracellular transport;;;	;;;;	A0A286ZT83;A0A287BB19;A0A5G2QR67;A0A5G2QZQ7;F1SBU0	RANBP3	RAN binding protein 3	NaN	NaN	6287873	NaN	1111989	NaN	NaN	NaN	1	NaN	1	NaN
;;;	;;;	;;;	A0A287A286;A0A5G2QF82;A0A5G2QUI7;F2Z5Q2	RPL24	TRASH domain-containing protein	NaN	NaN	344161.2	224856.7	320235.2	NaN	NaN	NaN	1	1	1	NaN
;	;	;	A0A287B9Z2;F1RUX1	CORO1B	Coronin	NaN	NaN	2.603919E+07	2.498797E+07	NaN	NaN	NaN	NaN	1	1	NaN	NaN
;;;;nucleosome,nuclear euchromatin,nuclear heterochromatin	;;;;positive regulation of transcription from RNA polymerase II promoter,cellular response to estradiol stimulus	;;;;RNA polymerase II core promoter proximal region sequence-specific DNA binding,RNA polymerase II core promoter sequence-specific DNA binding,RNA polymerase II distal enhancer sequence-specific DNA binding,nucleosomal DNA binding,protein heterodimerization activity	A0A5G2QJ24;A0A5G2R318;A0A5G2R9I5;A0A5G2RBH4;B1PEY3	H2AZ2;H2AZ2;H2AZ2;H2AZ2;H2A.Z	Histone H2A	NaN	NaN	324202	NaN	154646.9	328421.8	NaN	NaN	1	NaN	1	1
spliceosomal complex,cytosol,nuclear speck	regulation of alternative mRNA splicing, via spliceosome,mRNA processing,RNA splicing	pre-mRNA binding	Q06A98	SRSF2	Serine/arginine-rich splicing factor 2	NaN	NaN	3472393	2938827	NaN	5328766	NaN	NaN	4	4	NaN	4
;;;;;plasma membrane,cell-cell junction,focal adhesion,perinuclear region of cytoplasm	;;;;;positive regulation of gene expression,tumor necrosis factor-mediated signaling pathway,positive regulation of GTPase activity,establishment of protein localization,cell-cell junction organization,negative regulation of transcription, DNA-templated,positive regulation of focal adhesion assembly,cellular response to transforming growth factor beta stimulus,positive regulation of substrate adhesion-dependent cell spreading,positive regulation of NIK/NF-kappaB signaling	;;;;;zinc ion binding,protein kinase binding	A0A287BG02;A0A287BTD0;A0A5G2QPY8;A0A5G2R6E0;A0A5G2RHN2;F1SU28	LIMS1	LIM and senescent cell antigen-like-containing domain protein;LIM and senescent cell antigen-like-containing domain protein;Uncharacterized protein;LIM and senescent cell antigen-like-containing domain protein;LIM and senescent cell antigen-like-containing domain protein;LIM and senescent cell antigen-like-containing domain protein	NaN	NaN	149704.3	88908.8	520322.5	NaN	NaN	NaN	1	1	1	NaN
;cytosol;cytoplasm	;protein methylation;protein methylation	;protein-L-isoaspartate (D-aspartate) O-methyltransferase activity;protein-L-isoaspartate (D-aspartate) O-methyltransferase activity	A0A5G2QND0;J9JIK8;P80895	PCMT1	Protein-L-isoaspartate(D-aspartate) O-methyltransferase;Protein-L-isoaspartate O-methyltransferase;Protein-L-isoaspartate(D-aspartate) O-methyltransferase	NaN	NaN	64443.54	100164	101288.3	90483.08	NaN	NaN	2	2	2	2
;;cytosol,lamellipodium,actin cap	;;actin filament organization,response to bacterium,regulation of protein localization,cellular protein complex localization,spindle localization,dendritic spine morphogenesis,negative regulation of membrane tubulation,negative regulation of lymphocyte migration,positive regulation of Arp2/3 complex-mediated actin nucleation	;;actin binding	A0A287ATX4;A0A5G2QSR4;F1SMK2	WASL	Neural Wiskott-Aldrich syndrome protein;WASP like actin nucleation promoting factor;WASP like actin nucleation promoting factor	NaN	NaN	177714.5	1149852	NaN	NaN	NaN	NaN	1	1	NaN	NaN
;	;	;	A0A286ZJ91;A0A481C371	VASP	Vasodilator stimulated phosphoprotein;Vasodilator-stimulated phosphoprotein	NaN	NaN	110120.4	1502139	1159601	1103190	NaN	NaN	2	2	2	2
cytosol,plasma membrane,aryl hydrocarbon receptor complex	protein targeting to mitochondrion,xenobiotic metabolic process,protein maturation by protein folding,regulation of nucleic acid-templated transcription	transcription cofactor activity,aryl hydrocarbon receptor binding,GAF domain binding,unfolded protein binding	F1RUZ6	AIP	AH receptor-interacting protein	NaN	NaN	2242470	1909207	NaN	NaN	NaN	NaN	1	1	NaN	NaN
intracellular;;;;;;;;;	protein phosphorylation,intracellular signal transduction;;;;;;;;;	magnesium ion binding,protein serine/threonine kinase activity,ATP binding;;;;;;;;;	A0A287A3K5;A0A5G2QD87;A0A5G2QEW3;A0A5G2QIN5;A0A5G2QSL8;A0A5G2R3B9;A0A5G2R6S3;A0A5K1U3A5;F1SQN4;K7GQW4	RPS6KA3	Ribosomal protein S6 kinase;Ribosomal protein S6 kinase;Non-specific serine/threonine protein kinase;Ribosomal protein S6 kinase;Non-specific serine/threonine protein kinase;Non-specific serine/threonine protein kinase;Ribosomal protein S6 kinase;Non-specific serine/threonine protein kinase;Non-specific serine/threonine protein kinase;Non-specific serine/threonine protein kinase	NaN	NaN	110207.8	NaN	48231.42	NaN	NaN	NaN	2	NaN	2	NaN
;;nucleolus,cytoplasm;;	;;translational initiation,regulation of gene expression,RNA secondary structure unwinding;;	;;translation initiation factor activity,ATP-dependent RNA helicase activity,ATP binding;;	A0A286ZJC3;A0A287A8V1;A6M928;F6Q625;F6Q8Z7	EIF4A2;EIF4A1;EIF4A1;EIF4A1;EIF4A2	RNA helicase	NaN	NaN	2642754	NaN	NaN	1311980	NaN	NaN	1	NaN	NaN	1
;extracellular region,extracellular space	oxidation-reduction process;blood vessel morphogenesis,oxidation-reduction process	copper ion binding,oxidoreductase activity, acting on the CH-NH2 group of donors, oxygen as acceptor;protein-lysine 6-oxidase activity,copper ion binding	F1RLC4;P45845	LOX	Lysyl oxidase homolog;Protein-lysine 6-oxidase	NaN	NaN	2084260	5406346	1286708	4392708	NaN	NaN	5	5	5	5
;	;translational initiation	;translation initiation factor activity	A0A286ZZV4;A0A287A7Q7	EIF5	Eukaryotic translation initiation factor 5	NaN	NaN	990421.9	699652.8	1032789	160970.2	NaN	NaN	4	4	4	4
extracellular matrix;extracellular region	bone remodeling;bone remodeling	;	F1SM14;Q711S8	SPP2	Secreted phosphoprotein 2;Secreted phosphoprotein 24	NaN	NaN	704348	3265651	NaN	6433714	NaN	NaN	3	3	NaN	3
;;;;;;	;;;;;;	;;;;;;	A0A287A1V2;A0A287ALU0;A0A287AQ80;A0A287BRL7;A0A5G2QRU3;A0A5G2QVM6;P0DTA4	PCCA	Propanoyl-CoA:carbon dioxide ligase subunit alpha;Propanoyl-CoA:carbon dioxide ligase subunit alpha;Propanoyl-CoA:carbon dioxide ligase subunit alpha;Propionyl-CoA carboxylase alpha chain, mitochondrial;Propanoyl-CoA:carbon dioxide ligase subunit alpha;Propanoyl-CoA:carbon dioxide ligase subunit alpha;Propionyl-CoA carboxylase alpha chain, mitochondrial	NaN	NaN	2.029918E+08	NaN	1.488061E+08	256790.6	NaN	NaN	2	NaN	2	2
cytoplasm,centrosome	cerebral cortex radially oriented cell migration,centrosome localization		F1RZC6	CCDC141	Ig-like domain-containing protein	NaN	NaN	6004104	6319794	NaN	NaN	NaN	NaN	14	14	NaN	NaN
ER membrane protein complex,integral component of omegasome membrane;fibrillar center,cytoplasm,actin cytoskeleton	autophagosome assembly,protein folding in endoplasmic reticulum;Rho protein signal transduction,negative regulation of cell proliferation,negative regulation of Wnt signaling pathway,activation of GTPase activity,negative regulation of protein localization to cell surface	;beta-catenin binding,protein C-terminus binding	F1RHE3;F2Z516	TAX1BP3	Tax1 binding protein 3	NaN	NaN	2.283845E+07	NaN	7965801	1.191355E+07	NaN	NaN	1	NaN	1	1
;;;COP9 signalosome	;;;protein deneddylation	;;;	A0A286ZQZ3;A0A5G2QJQ6;A0A5G2QKU4;F2Z5Q3	COPS7A	COP9 signalosome subunit 7A	NaN	NaN	421209.1	NaN	NaN	107529.9	NaN	NaN	1	NaN	NaN	1
;;;;;;;;;	;;;;actin polymerization or depolymerization,positive regulation of protein tyrosine kinase activity;;;;;	;;;;protein tyrosine kinase activator activity;;;;;	A0A287A2E5;A0A287AUY1;A0A287B8G8;A0A287BCJ4;A0A287BDG8;A0A287BPV8;A0A287BSQ3;F1RTW7;F1RTW8;I3LHA4	ABI2;ABI2;ABI2;ABI1;ABI1;ABI2;ABI2;ABI1;ABI1;ABI1	Abl interactor 2;Abl interactor 2;Abl interactor 2;Abl interactor 1;Abl interactor 1;Abl interactor 2;Abl interactor 2;Abl interactor 1;Abl interactor 1;Abl interactor 1	NaN	NaN	662453.4	NaN	NaN	157743.3	NaN	NaN	1	NaN	NaN	1
mitochondrion,mitochondrial respiratory chain complex I	response to oxidative stress,oxidation-reduction process		F1SJP6	NDUFA6	Complex I-B14	NaN	NaN	1301689	NaN	NaN	683816.8	NaN	NaN	1	NaN	NaN	1
intracellular,plasma membrane,integral component of membrane	cAMP biosynthetic process,intracellular signal transduction	nucleotide binding,adenylate cyclase activity,aminoacyl-tRNA hydrolase activity	A0A287BPU6	ADCY3	Adenylate cyclase 3	NaN	NaN	1982959	273414.2	580749.6	1130260	NaN	NaN	1	1	1	1
;;;;;;nucleoplasm,Golgi apparatus	;;;;;lipid transport;lipid transport,positive regulation of sequestering of triglyceride,fat cell differentiation	;;;;;phosphatidylserine binding,cholesterol binding;	A0A287B9M3;A0A287BIQ4;A0A480DN09;A0A5G2QB99;A0A5G2R6Q9;F1RRF0;I3LBD6	OSBPL11;OSBPL10;OSBPL11;OSBPL11;OSBPL10;OSBPL10;OSBPL11	Oxysterol-binding protein	NaN	NaN	160850.5	NaN	NaN	NaN	NaN	NaN	1	NaN	NaN	NaN
			F1RGI2	PAFAH1B3	Platelet activating factor acetylhydrolase 1b catalytic subunit 3	NaN	NaN	184527.2	69075.68	81865.02	87237.15	NaN	NaN	1	1	1	1
;;nucleus	;;chromatin remodeling,ribonucleoside diphosphate catabolic process,D-ribose catabolic process,ATP generation from poly-ADP-D-ribose	;;magnesium ion binding,nucleotidyltransferase activity,ADP-sugar diphosphatase activity,snoRNA binding,protein homodimerization activity,8-oxo-dGDP phosphatase activity,ADP-ribose diphosphatase activity	A0A480XE17;A0A5G2QP36;F1RUP7	NUDT5	ADP-sugar pyrophosphatase isoform 1;Nudix hydrolase 5;Nudix hydrolase 5	NaN	NaN	100940.9	NaN	NaN	121408.4	NaN	NaN	1	NaN	NaN	1
;;;;;mitochondrion	;;;;;leucyl-tRNA aminoacylation,Requires Ontology	;;;;;aminoacyl-tRNA editing activity,leucine-tRNA ligase activity,ATP binding	A0A5G2QCW2;A0A5G2QTJ3;A0A5G2R8T0;F1SNZ5;I3LI93;I3LLA2	LARS2	Leucyl-tRNA synthetase	NaN	NaN	165181.8	NaN	NaN	NaN	NaN	NaN	1	NaN	NaN	NaN
;;nucleus	;;nucleosome assembly	;;	A0A287AD09;A0A287B8W3;F1SGD7	NAP1L1	Nucleosome assembly protein 1 like 1	NaN	NaN	1.002363E+07	1988629	NaN	NaN	NaN	NaN	2	2	NaN	NaN
;;;;;intracellular;cytoplasm	;;;;;ubiquitin-dependent protein catabolic process;ubiquitin-dependent protein catabolic process,protein deubiquitination	;;;;;thiol-dependent ubiquitin-specific protease activity;thiol-dependent ubiquitin-specific protease activity	A0A287BRT0;A0A5G2QHZ0;A0A5G2QK14;A0A5G2QNC6;A0A5G2RLD8;F1RHF0;Q06AB3	UCHL3	Ubiquitin carboxyl-terminal hydrolase;Ubiquitinyl hydrolase 1;Ubiquitin carboxyl-terminal hydrolase;Ubiquitin carboxyl-terminal hydrolase;Ubiquitin carboxyl-terminal hydrolase;Ubiquitin carboxyl-terminal hydrolase;Ubiquitin carboxyl-terminal hydrolase isozyme L3	NaN	NaN	3710573	2231736	NaN	2641430	NaN	NaN	1	1	NaN	1
;;;;;;;;;;;;;	;;;;;;;;;;;;;regulation of RNA splicing,negative regulation of myoblast differentiation	;;;;;metal ion binding;;;;;;;;metal ion binding	A0A286ZTG2;A0A286ZV49;A0A286ZY60;A0A287AH18;A0A287AT92;A0A287AVV5;A0A287BJI1;A0A287BQN7;A0A480ZSM5;F1SJM7;K7GMI2;K7GN96;K7GPR5;K7GQC3	MBNL1;MBNL1;MBNL1;MBNL1;MBNL1;MBNL1;MBNL1;MBNL3;MBNL1;MBNL1;MBNL3;MBNL3;MBNL3;MBNL3	Muscleblind like splicing regulator 1;Muscleblind like splicing regulator 1;Muscleblind like splicing regulator 1;Muscleblind like splicing regulator 1;Muscleblind like splicing regulator 1;Muscleblind like splicing regulator 1;Muscleblind like splicing regulator 1;Muscleblind like splicing regulator 3;Muscleblind like splicing regulator 1;Muscleblind like splicing regulator 1;Muscleblind like splicing regulator 3;Muscleblind like splicing regulator 3;Muscleblind like splicing regulator 3;Muscleblind like splicing regulator 3	NaN	NaN	395025.4	NaN	397496	144768.4	NaN	NaN	2	NaN	2	2
